{
  "schemaVersion": 1,
  "demo": false,
  "generatedAt": "2026-10-12T12:23:47.662185+00:00",
  "productions": [
    {
      "id": "playbill:222-a-ghost-story-off-broadway-lucille-lortel-theatre-2026",
      "title": "2:22 - A Ghost Story",
      "credits": "Danny Robins · Directed by Gabriel Vega Weissman",
      "image": "images/8824e1192ad3189c.jpg",
      "types": [
        "Off-Broadway"
      ],
      "description": "In this comedic thriller and West End hit, a woman believes her house is haunted, despite what her partner and friends think.",
      "runtimeMinutes": null,
      "company": "Lucille Lortel Theatre",
      "engagements": [
        {
          "id": "playbill:222-a-ghost-story-off-broadway-lucille-lortel-theatre-2026:lucille-lortel-theatre",
          "venue": "Lucille Lortel Theatre",
          "neighborhood": "West Village",
          "sourceId": "playbill",
          "sourceUrl": "https://playbill.com/shows/offbroadway",
          "url": "https://playbill.com/production/222-a-ghost-story-off-broadway-lucille-lortel-theatre-2026",
          "startDate": "2026-10-20",
          "openingDate": "2026-11-05",
          "closingDate": "2027-01-17",
          "status": "scheduled",
          "lastSeen": "2026-09-15T13:18:17.609624+00:00",
          "ticketUrl": "https://tickets.222aghoststory.com/booking/calendar/47218/2026-10?qt=2"
        }
      ],
      "imageSourceUrl": "https://www.todaytix.com/nyc/shows/47218-2-22-a-ghost-story",
      "descriptionSourceUrl": "https://www.todaytix.com/nyc/shows/47218-2-22-a-ghost-story",
      "descriptionMethod": "source-excerpt",
      "descriptionUpdatedAt": "2026-10-12T12:24:56.387851+00:00"
    },
    {
      "id": "playbill:america-who-hurt-you-off-broadway-theatre-for-a-new-audience-polonsky-shakespeare-center-2026",
      "title": "America, Who Hurt You?",
      "credits": "Sarah Jones · Directed by Eric Ting",
      "image": "images/53455c1fa82e982f.jpg",
      "types": [
        "Off-Broadway"
      ],
      "description": "In a nation divided by competing narratives, who gets to tell the story of America?",
      "runtimeMinutes": null,
      "company": "Theatre for a New Audience",
      "engagements": [
        {
          "id": "playbill:america-who-hurt-you-off-broadway-theatre-for-a-new-audience-polonsky-shakespeare-center-2026:theatre-for-a-new-audience",
          "venue": "Theatre for a New Audience",
          "neighborhood": "Fort Greene",
          "sourceId": "playbill",
          "sourceUrl": "https://playbill.com/shows/offbroadway",
          "url": "https://playbill.com/production/america-who-hurt-you-off-broadway-theatre-for-a-new-audience-polonsky-shakespeare-center-2026",
          "startDate": "2026-09-11",
          "openingDate": "2026-09-17",
          "closingDate": "2026-10-04",
          "status": "scheduled",
          "lastSeen": "2026-09-15T13:18:17.609624+00:00",
          "ticketUrl": "https://tfana.org/events/america-who-hurt-you"
        }
      ],
      "descriptionSourceUrl": "https://www.tdf.org/shows/23378/america-who-hurt-you/",
      "descriptionMethod": "source-excerpt",
      "imageSourceUrl": "https://www.tdf.org/shows/23378/america-who-hurt-you/",
      "descriptionUpdatedAt": "2026-10-12T12:24:56.387851+00:00"
    },
    {
      "id": "playbill:an-american-daughter-off-broadway-the-pershing-square-signature-center-irene-diamond-stage-2026",
      "title": "An American Daughter",
      "credits": "Wendy Wasserstein · Directed by Sarna Lapine",
      "image": "images/77338a29efbb672c.jpg",
      "types": [
        "Off-Broadway"
      ],
      "description": "Set in Washington, D.C., An American Daughter focuses on Dr. Lyssa Dent Hughes, a health care expert and 40-something daughter of a long-time senator.",
      "runtimeMinutes": null,
      "company": "Signature Theatre",
      "engagements": [
        {
          "id": "playbill:an-american-daughter-off-broadway-the-pershing-square-signature-center-irene-diamond-stage-2026:signature-theatre",
          "venue": "Signature Theatre",
          "neighborhood": "Hell's Kitchen",
          "sourceId": "playbill",
          "sourceUrl": "https://playbill.com/shows/offbroadway",
          "url": "https://playbill.com/production/an-american-daughter-off-broadway-the-pershing-square-signature-center-irene-diamond-stage-2026",
          "startDate": "2026-07-23",
          "openingDate": "2026-08-11",
          "closingDate": "2026-09-20",
          "status": "scheduled",
          "lastSeen": "2026-09-15T13:18:17.609624+00:00",
          "ticketUrl": "https://ci.ovationtix.com/36769/production/1276341"
        }
      ],
      "imageSourceUrl": "https://www.todaytix.com/nyc/shows/46998-an-american-daughter",
      "descriptionSourceUrl": "https://playbill.com/production/an-american-daughter-off-broadway-the-pershing-square-signature-center-irene-diamond-stage-2026",
      "descriptionMethod": "source-excerpt",
      "descriptionUpdatedAt": "2026-09-15T13:38:55.381394+00:00"
    },
    {
      "id": "playbill:anon-a-tempest-at-our-kitchen-table-off-broadway-the-robert-w-wilson-mcc-theater-space-2026",
      "title": "ANON: a tempest at our kitchen table",
      "credits": "Anne Washburn · Directed by Anne Kauffman",
      "image": "https://mcc-theater-assets.s3.amazonaws.com/uploads/2026/06/260605_MCC_Anon_Header_v01-1-1-25x10.png",
      "types": [
        "Off-Broadway"
      ],
      "description": "When a gay pride flag is unfurled across the street from Jeanie, an increasingly online TikToker in a suburb in Texas, two seemingly different households…freak out.",
      "runtimeMinutes": null,
      "company": "MCC Theater",
      "engagements": [
        {
          "id": "playbill:anon-a-tempest-at-our-kitchen-table-off-broadway-the-robert-w-wilson-mcc-theater-space-2026:mcc-theater",
          "venue": "MCC Theater",
          "neighborhood": "Hell's Kitchen",
          "sourceId": "playbill",
          "sourceUrl": "https://playbill.com/shows/offbroadway",
          "url": "https://playbill.com/production/anon-a-tempest-at-our-kitchen-table-off-broadway-the-robert-w-wilson-mcc-theater-space-2026",
          "startDate": "2026-09-25",
          "openingDate": "2026-10-14",
          "closingDate": "2026-11-01",
          "status": "scheduled",
          "lastSeen": "2026-09-15T13:18:17.609624+00:00",
          "ticketUrl": "https://mcctheater.org/tix/anon/"
        }
      ],
      "imageSourceUrl": "https://playbill.com/production/anon-a-tempest-at-our-kitchen-table-off-broadway-the-robert-w-wilson-mcc-theater-space-2026",
      "descriptionSourceUrl": "https://playbill.com/production/anon-a-tempest-at-our-kitchen-table-off-broadway-the-robert-w-wilson-mcc-theater-space-2026",
      "descriptionMethod": "source-excerpt",
      "descriptionUpdatedAt": "2026-09-15T13:38:55.381394+00:00"
    },
    {
      "id": "playbill:cat-cohen-broad-strokes-off-broadway-lucille-lortel-theatre-2026",
      "title": "Cat Cohen: Broad Strokes",
      "credits": "Directed by Alex Timbers",
      "image": "images/c847532dd78f198b.jpg",
      "types": [
        "Off-Broadway"
      ],
      "description": "After suffering a stroke at 30 caused by a literal hole in her heart, comedian Cat Cohen transforms this near-death experience into a wildly funny, song-filled one-woman show about mortality, hypochondria and the undeniable thrill of being the main character.",
      "runtimeMinutes": null,
      "company": "Lucille Lortel Theatre",
      "engagements": [
        {
          "id": "playbill:cat-cohen-broad-strokes-off-broadway-lucille-lortel-theatre-2026:lucille-lortel-theatre",
          "venue": "Lucille Lortel Theatre",
          "neighborhood": "West Village",
          "sourceId": "playbill",
          "sourceUrl": "https://playbill.com/shows/offbroadway",
          "url": "https://playbill.com/production/cat-cohen-broad-strokes-off-broadway-lucille-lortel-theatre-2026",
          "startDate": "2026-07-14",
          "openingDate": "2026-07-27",
          "closingDate": "2026-09-25",
          "status": "scheduled",
          "lastSeen": "2026-09-15T13:18:17.609624+00:00",
          "ticketUrl": "https://www.catcohenbroadstrokes.com/"
        }
      ],
      "imageSourceUrl": "https://www.todaytix.com/nyc/shows/46802-cat-cohen-broad-strokes",
      "descriptionSourceUrl": "https://playbill.com/production/cat-cohen-broad-strokes-off-broadway-lucille-lortel-theatre-2026",
      "descriptionMethod": "source-excerpt",
      "descriptionUpdatedAt": "2026-09-15T13:38:55.381394+00:00"
    },
    {
      "id": "playbill:crazy-mama-a-true-story-of-love-and-madness-off-broadway-59e59-theater-c-2026",
      "title": "Crazy Mama: A True Story of Love and Madness",
      "credits": "Sharon Scott Williams · Directed by Anson Williams",
      "image": "images/3403f8b905d0fefb.jpg",
      "types": [
        "Off-Broadway"
      ],
      "description": "As Mama continues to be committed to mental institutions, convinced she’s working for the FBI, Daddy blurs his pain with Kentucky bourbon and teenage brother Spikey struggles with his faith.",
      "runtimeMinutes": null,
      "company": "59E59 Theaters",
      "engagements": [
        {
          "id": "playbill:crazy-mama-a-true-story-of-love-and-madness-off-broadway-59e59-theater-c-2026:59e59-theaters",
          "venue": "59E59 Theaters",
          "neighborhood": "Midtown East",
          "sourceId": "playbill",
          "sourceUrl": "https://playbill.com/shows/offbroadway",
          "url": "https://playbill.com/production/crazy-mama-a-true-story-of-love-and-madness-off-broadway-59e59-theater-c-2026",
          "startDate": "2026-09-16",
          "openingDate": "2026-09-18",
          "closingDate": "2026-10-18",
          "status": "scheduled",
          "lastSeen": "2026-09-15T13:18:17.609624+00:00",
          "ticketUrl": "https://www.59e59.org/shows/show-detail/crazy-mama-a-true-story-of-love-and-madness/"
        }